{
  "name": "Tiefling",
  "description": "Tieflings are either born in the Lower Planes or have fiendish ancestors who originated there. A tiefling (pronounced TEE-fling) is linked by blood to a devil, a demon, or some other Fiend. This connection to the Lower Planes is the tiefling's fiendish legacy, which comes with the promise of power yet has no effect on the tiefling's moral outlook. A tiefling chooses whether to embrace or lament their fiendish legacy.",
  "creatureType": "Humanoid",
  "size": {
    "category": "Medium",
    "height": "about 4–7 feet tall",
    "canChoose": true,
    "options": [
      {
        "category": "Medium",
        "height": "about 4–7 feet tall"
      },
      {
        "category": "Small",
        "height": "about 3–4 feet tall"
      }
    ]
  },
  "speed": 30,
  "traits": [
    {
      "name": "Darkvision",
      "description": "You have Darkvision with a range of 60 feet.",
      "type": "passive"
    },
    {
      "name": "Fiendish Legacy",
      "description": "You are the recipient of a legacy that grants you supernatural abilities. Choose a legacy from the Fiendish Legacies table. You gain the level 1 benefit of the chosen legacy. When you reach character levels 3 and 5, you learn a higher-level spell, as shown on the table. You always have that spell prepared. You can cast it once without a spell slot, and you regain the ability to cast it in that way when you finish a Long Rest. You can also cast the spell using any spell slots you have of the appropriate level. Intelligence, Wisdom, or Charisma is your spellcasting ability for the spells you cast with this trait (choose the ability when you select the legacy).",
      "type": "passive"
    },
    {
      "name": "Otherworldly Presence",
      "description": "You know the Thaumaturgy cantrip. When you cast it with this trait, the spell uses the same spellcasting ability you use for your Fiendish Legacy trait.",
      "type": "spell"
    }
  ],
  "variants": [
    {
      "name": "Abyssal Legacy",
      "description": "The entropy of the Abyss, the chaos of Pandemonium, and the despair of Carceri call to tieflings who have the abyssal legacy. Horns, fur, tusks, and peculiar scents are common physical features of such tieflings, most of whom have the blood of demons coursing through their veins.",
      "traits": [
        {
          "name": "Poison Resistance",
          "description": "You have Resistance to Poison damage.",
          "type": "resistance"
        }
      ],
      "spellProgression": {
        "spellcastingAbility": ["Intelligence", "Wisdom", "Charisma"],
        "level1": ["Poison Spray"],
        "level3": "Ray of Sickness",
        "level5": "Hold Person"
      }
    },
    {
      "name": "Chthonic Legacy",
      "description": "Tieflings who have the chthonic legacy feel not only the tug of Carceri but also the greed of Gehenna and the gloom of Hades. Some of these tieflings look cadaverous. Others possess the unearthly beauty of a succubus, or they have physical features in common with a night hag, a yugoloth, or some other Neutral Evil fiendish ancestor.",
      "traits": [
        {
          "name": "Necrotic Resistance",
          "description": "You have Resistance to Necrotic damage.",
          "type": "resistance"
        }
      ],
      "spellProgression": {
        "spellcastingAbility": ["Intelligence", "Wisdom", "Charisma"],
        "level1": ["Chill Touch"],
        "level3": "False Life",
        "level5": "Ray of Enfeeblement"
      }
    },
    {
      "name": "Infernal Legacy",
      "description": "The infernal legacy connects tieflings not only to Gehenna but also the Nine Hells and the raging battlefields of Acheron. Horns, spines, tails, golden eyes, and a faint odor of sulfur or smoke are common physical features of such tieflings, most of whom trace their ancestry to devils.",
      "traits": [
        {
          "name": "Fire Resistance",
          "description": "You have Resistance to Fire damage.",
          "type": "resistance"
        }
      ],
      "spellProgression": {
        "spellcastingAbility": ["Intelligence", "Wisdom", "Charisma"],
        "level1": ["Fire Bolt"],
        "level3": "Hellish Rebuke",
        "level5": "Darkness"
      }
    }
  ],
  "senses": {
    "darkvision": 60
  },
  "sourceBook": "Player's Handbook 2024"
}