{
  "name": "Human",
  "description": "Found throughout the multiverse, humans are as varied as they are numerous, and they endeavor to achieve as much as they can in the years they are given. Their ambition and resourcefulness are commended, respected, and feared on many worlds. Humans are as diverse in appearance as the people of Earth, and they have many gods. Scholars dispute the origin of humanity, but one of the earliest known human gatherings is said to have occurred in Sigil, the torus-shaped city at the center of the multiverse and the place where the Common language was born. From there, humans could have spread to every part of the multiverse, bringing the City of Doors' cosmopolitanism with them.",
  "creatureType": "Humanoid",
  "size": {
    "category": "Medium",
    "height": "about 4–7 feet tall",
    "canChoose": true,
    "options": [
      {
        "category": "Medium",
        "height": "about 4–7 feet tall"
      },
      {
        "category": "Small",
        "height": "about 2–4 feet tall"
      }
    ]
  },
  "speed": 30,
  "traits": [
    {
      "name": "Resourceful",
      "description": "You gain Heroic Inspiration whenever you finish a Long Rest.",
      "type": "passive"
    },
    {
      "name": "Skillful",
      "description": "You gain proficiency in one skill of your choice.",
      "type": "proficiency"
    },
    {
      "name": "Versatile",
      "description": "You gain an Origin feat of your choice. Skilled is recommended.",
      "type": "passive"
    }
  ],
  "sourceBook": "Player's Handbook 2024"
}