{
  "name": "Dwarf",
  "description": "Dwarves were raised from the earth in the elder days by a deity of the forge. Called by various names on different worlds—Moradin, Reorx, and others—that god gave dwarves an affinity for stone and metal and for living underground. The god also made them resilient like the mountains, with a life span of about 350 years. Squat and often bearded, the original dwarves carved cities and strongholds into mountainsides and under the earth. Their oldest legends tell of conflicts with the monsters of mountaintops and the Underdark, whether those monsters were towering giants or subterranean horrors. Inspired by those tales, dwarves of any culture often sing of valorous deeds—especially of the little overcoming the mighty.",
  "creatureType": "Humanoid",
  "size": {
    "category": "Medium",
    "height": "about 4–5 feet tall"
  },
  "speed": 30,
  "lifespan": "about 350 years",
  "traits": [
    {
      "name": "Darkvision",
      "description": "You have Darkvision with a range of 120 feet.",
      "type": "passive"
    },
    {
      "name": "Dwarven Resilience",
      "description": "You have Resistance to Poison damage. You also have Advantage on saving throws you make to avoid or end the Poisoned condition.",
      "type": "resistance"
    },
    {
      "name": "Dwarven Toughness",
      "description": "Your Hit Point maximum increases by 1, and it increases by 1 again whenever you gain a level.",
      "type": "passive",
      "scalesWithLevel": true
    },
    {
      "name": "Stonecunning",
      "description": "As a Bonus Action, you gain Tremorsense with a range of 60 feet for 10 minutes. You must be on a stone surface or touching a stone surface to use this Tremorsense. The stone can be natural or worked. You can use this Bonus Action a number of times equal to your Proficiency Bonus, and you regain all expended uses when you finish a Long Rest.",
      "type": "bonus_action",
      "usesPerRest": "proficiency",
      "restType": "long"
    }
  ],
  "resistances": ["Poison"],
  "senses": {
    "darkvision": 120
  },
  "sourceBook": "Player's Handbook 2024"
}